공통표준단어명,공통표준단어영문약어명,공통표준단어 영문명,공통표준단어 설명,형식단어여부,공통표준도메인분류명,이음동의어 목록,금칙어 목록,제정차수,"개정구분명(폐기 또는 변경)",개정항목,개정사유
1회섭취참고량,RAFOS,Reference Amount For One Serving,一回攝取參考量. 만 3세 이상 소비계층이 통상적으로 소비하는 식품별 1회 섭취량과 시장조사 결과 등을 바탕으로 설정한 값을 말한다 ,N,,,,5차(2022-07),,,
1회투여량,SGLDS,Single Dose,一回投與量. 한 번에 약물이나 주사 등이 몸에 투여되는 구체적인 양,Y,수,,,8차(2025-11),,,
API,API,Application Programming Interface,"API. 운영 체제, 프로그래밍 언어 등에 있는 라이브러리를 응용 프로그램 개발 시 이용할 수 있도록 규칙들을 정의해 놓은 인터페이스",N,,,,6차(2023-11),,,
CAS,CAS,Chemical Abstract Service,CAS. 화학적 동질성을 갖는 물질에 대하여 미국 화학회(化學會)에서 부여한 고유 번호,N,,,,6차(2023-11),,,
CCTV,CCTV,Closed-Circuit Television,CCTV. 특정 수신자를 대상으로 화상을 전송하는 텔레비전 방식,N,,,,8차(2025-11),,,
CI,CI,Connecting Information,"Connecting Information. 여러 온라인 서비스에서 동일인을 확인할 수 있는 연계 정보로, 본인인증을 거친 뒤 사업자 간 사용자를 식별할 수 있는 암호화된 고유값",N,,,,8차(2025-11),,,
CMS,CMS,Cash Management Service,"CMS. 은행에 직접 가지 않고도 컴퓨터나 단말기를 통신 회선으로 연결하여 은행이 제공하는 각종 금융 거래 정보를 이용하거나, 자금의 효율적 관리, 자금 대체 따위를 할 수 있는 서비스",N,,,,7차(2024-11),,,
CPU,CPU,Central Processing Unit,CPU. 컴퓨터 시스템 전체의 작동을 통제하고 프로그램의 모든 연산을 수행하는 가장 핵심적인 장치,N,,,,6차(2023-11),,,
DI,DI,Duplication Information,"Duplication/Dedication Information. 중복가입 확인 정보로, 하나의 서비스 내에서 동일 사용자의 중복 가입을 막고, 계정 구분을 위한 식별값",N,,,,8차(2025-11),,,
EAI,EAI,Enterprise Application Integration,EAI. 기업 내 연관된 모든 애플리케이션을 유기적으로 연동하여 필요한 정보를 집중적으로 통합하는 일,N,,,,7차(2024-11),,,
ERP,ERP,Enterprise Resourceㅎ Planning,Enterprise Resource Planning. 기업의 모든 업무 프로세스와 자원을 통합적으로 관리하는 시스템 및 소프트웨어,N,,,,8차(2025-11),,,
ESB,ESB,Enterprise Service Bus,Enterprise Service Bus. 여러 이기종 시스템을 효율적으로 연계하는 미들웨어 플랫폼,N,,,,8차(2025-11),,,
FAQ,FAQ,Frequently Asked Question,FAQ. 많은 사람이 자주 물어보는 질문과 그에 대한 답을 정리해 놓은 문서,N,,,,6차(2023-11),,,
G2B,G2B,Government-To-Business,"G2B. 정부-기업 간 거래. 정부 전자조달. 물품이나 용역의 입찰, 공문서 교환 등의 사업",N,,,,7차(2024-11),,,
GIS,GIS,Geographic Information System,GIS. 지리정보시스템(Geographic Information System) 지도에 관한 속성 정보를 컴퓨터를 이용해서 해석하는 지도 정보 시스템,N,,,,4차(2021-12),,,
HTML,HTML,Hypertext Markup Language,HTML. 하이퍼링크를 사용하는 컴퓨터 언어. 홈페이지 제작에 주로 사용하는 언어로 표시가 있는 글을 선택하면 그것과 연결되어 있는 내용을 보여 주거나 연결되어 있는 프로그램을 실행,N,,,,1차(2020-08),,,
IMO,IMO,International Maritime Organization,"International Maritime Organization. 국제해사기구를 칭하며 배의 항로, 교통 규칙, 항만 시설 따위의 국제적 통일을 목적으로 설립한 국제 연합의 전문 기구",N,,,,8차(2025-11),,,
IP,IP,Internet Protocol,"IP. OSI 모델의 제3계층(네트워크층)에 해당되는 프로토콜로 IP계층에 따라 다른 네트워크 간 패킷의 전송, 즉 경로 제어를 위한 규약",N,,아이피,,2차(2020-12),,,
MAC,MAC,Medium Access Control,"MAC. OSI 기본 참조 모델의 데이터 링크 계층의 일부로서, 동일한 매체를 여러 노드가 공유하는 특성상에 존재하는 구내 정보 통신망(LAN) 고유의 계층",N,,,,2차(2020-12),,,
MMS,MMS,Multimedia Messaging Service,"MMS. 3세대 이동통신 서비스의 기본 요소로서 정지 영상, 음악, 음성 및 동영상 등의 다양한 형식의 데이터를 주고받을 수 있는 메시징 시스템",N,,,,7차(2024-11),,,
OTP,OTP,One-Time Password,OTP. 사용자 인증을 위하여 로그인을 할 때마다 매번 새로 생성되는 비밀번호,N,,,,8차(2025-11),,,
PDF,PDF,Portable Document Format,PDF. 원본 문서가 어떠한 애플리케이션에서 작성되었는지에 상관없이 여러 플랫폼 환경에서 문서를 동일하게 출력하고 디스플레이할 수 있도록 해주는 파일 포맷,N,,,,6차(2023-11),,,
PG,PG,Payment Gateway,"PG. 인터넷상에서 금융 기관과 하는 거래를 대행해 주는 업체. 신용 카드 거래, 계좌 이체, 핸드폰 이용 결제 등 다양한 소액 결제 서비스를 대신 제공해 준다",N,,,,6차(2023-11),,,
POS,POS,Point Of Sales,"POS. 상점의 전자식 금전 등록기, 정찰 판독 장치 등을 컴퓨터에 연결하여 상품 데이터를 관리하는 시스템",N,,,,7차(2024-11),,,
PQ,PQ,Pre-Qualification,"Pre-Qualification. 입찰 전 사업수행능력 사전심사로, 일정 수준 이상의 역량과 신뢰도를 갖춘 업체만 공사나 용역 입찰에 참가할 수 있도록 제한하는 제도",N,,,,8차(2025-11),,,
QR코드,QRCD,Quick Response Code,"QR CODE. 컴퓨터로 만든 흑백 격자무늬 코드로, 정보를 나타내는 매트릭스 형식의 이차원 코드",N,,큐알코드,,7차(2024-11),,,
RFID,RFID,Radio Frequency Identification,RFID. 전파 신호를 통해 비접촉식으로 사물에 부착된 얇은 평면 형태의 태그를 식별하여 정보를 처리하는 시스템,N,,,,7차(2024-11),,,
RSS,RSS,Really Simple Syndication,RSS. 웹 사이트 간의 자료 교환 및 배급을 위한 확장성 링크 언어(XML) 기반의 규격,N,,,,7차(2024-11),,,
SMS,SMS,Short Message Service,"SMS. 컴퓨터, 휴대전화 이용자들이 별도의 부가장비 없이도 간단한 단문의 메시지를 주고 받을 수 있는 문자 서비스",N,,,,1차(2020-08),,,
SNS,SNS,Social Networking Service,SNS. 동일한 관심 또는 특성을 갖는 사람들이 연결될 수 있도록 온라인 기반의 개인 간 소셜 네트워크를 만들고 운영하는 데 초점을 맞춘 서비스,N,,,,7차(2024-11),,,
SQL,SQL,Structured Query Language,SQL. 관계형 데이터베이스 관리 시스템(RDBMS) 또는 관계형 데이터 스트림 관리 시스템(RDSMS)의 조작과 관리를 위한 표준 질의 언어,N,,,,6차(2023-11),,,
SSL,SSL,Secure Sockets Layer,SSL. 인터넷상에서 데이터 통신 보안을 제공하는 암호 프로토콜,N,,,,7차(2024-11),,,
SSO,SSO,Single Sign-On,Single Sign-On. 한 번 인증으로 여러 시스템 이용 가능하도록 하는 통합 로그인 기술,N,,,,8차(2025-11),,,
TV수신료,TVSFE,TV Subscription Fee,TV受信料. 텔레비전 방송을 수신하는 대가로 지불하는 돈,Y,요금,,,7차(2024-11),,,
URL,URL,Uniform Resource Locator,URL. 확인된 리소스가 어디에 있는지 또 이를 탐색하는 메커니즘이 어디에 있는지에 대해 규정하는 URL,N,,,,2차(2020-12),,,
VOC,VOC,Voice of Customer,"VOC. 콜센터에 접수되는 고객의 불만 사항에 대해, 접수부터 처리까지 처리 상황을 실시간으로 관리하고 처리 결과를 관서별로 지표화하여 관리하고 평가함으로써 고객의 체감 서비스를 향상하는 고객 관리 시스템",N,,,,6차(2023-11),,,
WBS,WBS,Work Breakdown Structure,"WBS. 프로젝트 과업과 하위 과업 그리고 작업 단위의 계층을 나타내는 구조. 한 개 이상의 작업 단위가 완성되어 하위 과업이 완성되고, 한 개 이상의 하위 과업이 완성되어 프로젝트가 완성된다",N,,,,7차(2024-11),,,
XML,XML,Extensible Mark-Up Language,Extensible Markup Language. 데이터를 저장하고 전달하는 데 사용되는 다목적 마크업 언어,N,,,,8차(2025-11),,,
X좌표,XCRD,X-Coordinate,"X座標. 직선·평면·공간에서 점의 위치를 나타낼 때, 원점에서 직각으로 만나는 두 좌표축(X축과 Y축)을 사용해서 X축에 내린 수선의 눈금인 x를 그 점의 x좌표 또는 가로좌표라고 함",Y,좌표,,,6차(2023-11),,,
Y좌표,YCRD,Y-Coordinate,"Y座標. 직선·평면·공간에서 점의 위치를 나타낼 때, 원점에서 직각으로 만나는 두 좌표축(X축과 Y축)을 사용해서 Y축에 내린 수선의 눈금인 y를 그 점의 y좌표 또는 세로좌표라고 함",Y,좌표,,,6차(2023-11),,,
Z좌표,ZCRD,Z-Coordinate,"Z座標. 3차원의 데카르트 좌표계에서 가로축(X축)과 세로축(Y축)에 대하여 직각이 되는 제3의 축(Z축)을 의미. X-Y-Z 좌표계는 길이, 너비, 깊이를 갖는 모델을 생성하여 3차원 공간에서 모델을 이동하는 데 사용된다",Y,좌표,,,7차(2024-11),,,
가감,ADSB,Addition And Subtraction,加減. 더하거나 빼는 일 또는 그렇게 하여 알맞게 맞추는 일,N,,,,6차(2023-11),,,
가격,PRC,Price,價格. 물건이 지니고 있는 가치를 돈으로 나타낸 것,Y,가격,,,6차(2023-11),,,
가결,PSD,Passed,"可決. 회의에서, 제출된 의안을 합당하다고 결정함",N,,,,8차(2025-11),,,
가계수표,PSCK,Personal Check,家計手票. 은행에 가계 종합 예금 계좌를 가진 사람이 그 은행 앞으로 발행하는 소액 수표,N,,,,8차(2025-11),,,
가공비,PRCFE,Processing Fee,加工費. 가공을 하는 데 드는 비용,Y,비용,,,8차(2025-11),,,
가구,HSHD,Household,家口. 현실적으로 주거 및 생계를 같이하는 사람의 집단을 세는 단위,N,,,,6차(2023-11),,,
가능,PSBLTY,Possibility,可能. 할 수 있거나 될 수 있음,N,,,,3차(2021-10),,,
가동,OPRTNG,Operating,稼動. 사람이나 기계 따위가 움직여 일함. 또는 기계 따위를 움직여 일하게 함,N,,,,4차(2021-12),,,
가동률,OPRT,Operation Rate,稼動率. 생산 설비가 가동될 수 있는 최대 시간과 실지로 가동한 시간의 비율,Y,율,,,7차(2024-11),,,
가로,WDTH,Width,가로. 왼쪽에서 오른쪽으로 나 있는 방향 또는 그 길이,N,,,,6차(2023-11),,,
가맹점,FRCS,Franchise,加盟店. 어떤 조직의 동맹이나 연맹에 든 가게나 상점,N,,,,2차(2020-12),,,
가분할,DVSB,Divisible,"可分割. 해당 부지, 구역, 재산 등에서 실제로 분할이 허용되는 것",N,,,,8차(2025-11),,,
가산,ADTN,Addition,加算. 더하여 셈함. 몇 개의 수나 식 따위를 합하여 계산함. 또는 그런 셈,N,,,,2차(2020-12),,,
가산금,ADAMT,Additional Amount,"加算金. 세금이나 공공요금 따위를 납부 기한까지 내지 않은 경우, 원래 금액에 일정한 비율로 덧붙여 매기는 금액",Y,금액,,,8차(2025-11),,,
가산세,ADDTX,Additional Tax,加算稅. 규정한 세금을 납부하지 않았을 때 본래 부과된 금액에 일정 비율로 금액을 부과하는 세금,Y,금액,,,5차(2022-07),,,
가산점,ADSC,Additional Score,加算點. 어떤 것에 대한 대가로 더 주는 점수,N,,,,7차(2024-11),,,
가상,VR,Virtual,假象. 주관적으로는 실제 있는 것처럼 보이나 객관적으로는 존재하지 않는 거짓 현상. 假想. 사실이 아니거나 사실 여부가 분명하지 않은 것을 사실이라고 가정하여 생각함,N,,,,2차(2020-12),,,
가속도,ACL,Acceleration,加速度. 일의 진행에 따라 점점 더해지는 속도 또는 그렇게 변하는 속도,Y,수,,,8차(2025-11),,,
가수금,SPRCP,Suspense Receipt,假受金. 부기(簿記)에서 처리할 계정이 미정(未定)인 상태로 우선 받아 두는 돈,Y,금액,,,6차(2023-11),,,
가스,GAS,Gas,GAS. 기체 물질을 통틀어 이르는 말,N,,,,6차(2023-11),,,
가압류,PRAT,Provisional Attachment,假押留. 민사 소송법에서 법원이 채권자를 위하여 나중에 강제 집행을 할 목적으로 채무자의 재산을 임시로 확보하는 일,N,,,,6차(2023-11),,,
가액,EQVL,Equivalent Value,價額. 물건의 가치에 상당한 금액,Y,금액,,,6차(2023-11),,,
가용,AVL,Available,可用. 사용할 수 있음,N,,,,7차(2024-11),,,
가입,JOIN,Join,"加入. 조직이나 단체 따위에 들어가거나, 서비스를 제공하는 상품 따위를 신청함",N,,,,1차(2020-08),,,
가입비,MBSFE,Membership Fee,加入費. 어떤 모임 따위에 들어가기 위하여 필요한 비용,Y,비용,,,8차(2025-11),,,
가입자,SBSR,Subscriber,加入者. 조직이나 단체 따위에 들어간 사람 또는 서비스를 제공하는 상품 따위를 신청한 사람,N,,,,6차(2023-11),,,
가족,FAM,Family,"家族. 주로 부부를 중심으로 한, 친족 관계에 있는 사람들의 집단. 또는 그 구성원. 혼인, 혈연, 입양 등",N,,,,2차(2020-12),,,
가족력,FMHST,Family History,"家族歷. 환자의 가족이나 가까운 친척, 같이 사는 사람들의 의학적 내력",N,,,,8차(2025-11),,,
가중치,WGVL,Weighted Value,加重値. 일반적으로 평균치를 산출할 때 개별치에 부여되는 중요도 또는 어떤 상품이 경제생활에서 차지하는 중요도,N,,,,6차(2023-11),변경,공통표준단어 설명,유관 단어와의 통일성 및 적합성을 고려하여 설명 수정
가중평균,WGAV,Weighted Average,加重平均. 각 항의 수치에 그 중요도에 비례하는 계수를 곱한 다음 산출한 평균,N,,,,8차(2025-11),,,
가지급,PRVPY,Provisional Payment,假支給. 치를 돈 따위의 일부 또는 전액을 정한 날보다 앞당겨 임시로 지급하는 일,N,,가지불,,6차(2023-11),,,
가축,LVST,Livestock,家畜. 집에서 기르는 짐승,N,,,,8차(2025-11),,,
가치,WRTH,Worth,價値. 사물이 지니고 있는 쓸모,N,,,,6차(2023-11),,,
가해자,ASLNT,Assailant,"加害者. 다른 사람의 생명이나 신체, 재산, 명예 따위에 해를 끼친 사람",N,,,,7차(2024-11),,,
각도,ANGL,Angle,角度. 한 점에서 갈리어 나간 두 직선의 벌어진 정도,Y,수,,,8차(2025-11),,,
각하,RJTN,Rejection,"却下. 행정법에서, 국가 기관에 대한 행정상 신청을 배척하는 처분",N,,,,6차(2023-11),,,
간선시설,ATLFCS,Arterial Facilities,幹線施設. 도로ㆍ상하수도ㆍ전기시설ㆍ가스시설ㆍ통신시설 및 지역난방시설 등 주택단지 안의 기간시설을 그 주택단지 밖에 있는 같은 종류의 기간시설에 연결하는 시설,N,,,,4차(2021-12),,,
간염,HPTS,Hepatitis,肝炎. 간에 생기는 염증을 통틀어 이르는 말,N,,,,8차(2025-11),,,
간접,IDRT,Indirect,間接. 중간에 매개(媒介)가 되는 사람이나 사물 따위를 통하여 맺어지는 관계,N,,,,6차(2023-11),,,
간접비,IDRCO,Indirect Cost,間接費. 여러 가지 제품의 생산에 공통으로 소요되는 비용,Y,비용,"간접생산비, 공통비용",,6차(2023-11),,,
간행물,PBLC,Publication,"刊行物. 간행된 책, 신문, 그림 따위를 통틀어 이르는 말",N,,발간물,,6차(2023-11),,,
간호사,NRS,Nurse,看護師. 의사의 진료를 돕고 환자를 돌보는 사람으로서 법으로 그 자격을 정함,N,,,,6차(2023-11),,,
감가상각,DPRC,Depreciation,減價償却. 토지를 제외한 고정 자산에 생기는 가치의 소모를 셈하는 회계상의 절차. 고정 자산 가치의 소모를 각 회계 연도에 할당하여 그 자산의 가격을 줄여 간다,N,,,,7차(2024-11),,,
감가상각률,DPRT,Depreciation Rate,減價償却率. 유형의 고정 자산의 원가에 대한 감가상각액의 비율,Y,율,,,6차(2023-11),,,
감가상각비,DPCO,Depreciation Cost,減價償却費. 감가상각액을 충당하는 비용,Y,비용,,,6차(2023-11),,,
감독자,SPVSR,Supervisor,監督者. 감독하는 사람,N,,,,6차(2023-11),,,
감리,SPVS,Supervision,監理. 감독하고 관리함,N,,,,6차(2023-11),,,
감리원,SPVR,Supervisor,監理員. 감리 업무를 하는 사람,N,,감리자,,7차(2024-11),,,
감면,RDCT,Reduction,減免. 매겨야 할 부담 따위를 덜어 주거나 면제함,N,,,,6차(2023-11),,,
감면율,RDCRT,Reduction Rate,減免率. 매겨야 할 부담 따위를 덜어 주거나 면제한 정도. 또는 그 비율,Y,율,,,6차(2023-11),,,
감사,ADT,Audit,勘査. 잘 살펴 조사함,N,,,,6차(2023-11),,,
감사인,ADTR,Auditor,監査人. 실제로 감사 업무를 담당하는 사람을 이르는 말,N,,감사자,,7차(2024-11),,,
감소,DCRS,Decrease,減少. 양이나 수치가 줆. 또는 양이나 수치를 줄임,N,,,,6차(2023-11),,,
감소율,RDRT,"	Reduction Rate",減少率. 줄어드는 비율,Y,율,,,8차(2025-11),,,
감액,RDAMT,Reduction Amount,減額. 액수를 줄임 또는 줄인 액수,N,,,,6차(2023-11),,,
감점,SBPT,Subtract Points,減點. 점수가 깎임 또는 그 점수,N,,,,6차(2023-11),,,
감정,APRS,Appraisal,"鑑定. 사물의 특성이나 참과 거짓, 좋고 나쁨을 분별하여 판정함",N,,,,6차(2023-11),,,
감정가,APPRC,Appraised Price,"鑑定價. 골동품, 역사 자료, 보석, 토지 따위의 사물에 대하여 특성이나 가치를 분별하여 매기는 가격",Y,가격,감정값,,6차(2023-11),,,
감축량,RDQTY,Reduction Quantity,減縮量. 종전보다 소비하거나 버리던 양에서 줄인 양,Y,수,,,8차(2025-11),,,
값,VL,Value,값. 어떤 사물의 중요성이나 의의,N,,,,5차(2022-07),,,
강도,STR,Strength,強度. 어떤 것의 센 정도 또는 전장(電場)·전류(電流)·방사능 따위의 양(量)의 세기,Y,수,,,8차(2025-11),,,
강등,DMTN,Demotion,降等. 등급이나 계급 따위가 낮아짐 또는 등급이나 계급 따위를 낮춤,N,,,,8차(2025-11),,,
강사,INSTR,Instructor,講師. 학교나 학원 따위에서 위촉을 받아 강의를 하는 사람,N,,,,2차(2020-12),,,
강사료,LCFE,Lecturer Fee,講師料. 강의를 한 대가로 받는 돈,Y,요금,,,8차(2025-11),,,
강설량,SNFL,Snowfall,降雪量. 일정한 기간 동안 일정한 곳에 내린 눈의 양,Y,수,,,8차(2025-11),,,
강수,PRCP,Precipitation,"降水. 비, 눈, 우박, 안개 따위로 지상에 내린 물",N,,,,8차(2025-11),,,
강수량,RN,Rainfall,"降水量. 비, 눈, 우박, 안개 따위로 일정 기간 동안 일정한 곳에 내린 물의 총량",Y,수,,,6차(2023-11),,,
강수확률,POR,Probability Of Rainfall,降水確率. 일정한 지역 안에 있는 임의의 장소에서 지정한 시간 동안 측량할 만한 충분한 양의 비가 내릴 확률,Y,율,,,6차(2023-11),,,
강열감량,IGLS,Ignition Loss,强熱減量. 시료를 고온에서 가열했을 때 무게가 감소하는 현상,N,,,,8차(2025-11),,,
강우량,RNFL,Rainfall,降雨量. 일정 기간 동안 일정한 곳에 내린 비의 분량,Y,수,,,8차(2025-11),,,
강의,LCTR,Lecture,講義. 학문이나 기술의 일정한 내용을 체계적으로 설명하여 가르침,N,,,,6차(2023-11),,,
강의료,LCTRFE,Lecture Fee,講義料. 강의에 대한 보수로 받거나 내는 돈,Y,요금,,,8차(2025-11),,,
강의실,LCTRM,Lecture Room,講義室. 강의하는 데 쓰는 방,N,,,,6차(2023-11),,,
강점,STRPT,Strong Point,強點. 남보다 우세하거나 더 뛰어난 점,N,,,,8차(2025-11),,,
강좌,CORS,Course,講座. 강의나 강연 또는 설교를 하는 자리,N,,,,8차(2025-11),,,
개간면적,LDRCAR,Land Reclamation Area,開墾面積. 거친 땅이나 버려둔 땅을 일구어 쓸모 있는 땅으로 만든 공간의 넓이,Y,면적,,,8차(2025-11),,,
개관,OPNNG,Opening,"開館. 도서관, 영화관, 박물관, 회관 따위의 기관이 설비를 차려 놓고 처음이나 그날의 일을 시작하기 위하여 문을 엶 또는 그렇게 함",N,,,,7차(2024-11),변경,공통표준단어 설명,유관 단어와의 통일성 및 적합성을 고려하여 설명 수정
개교,OPSCH,Open A School,開校. 학교를 새로 세워 처음으로 운영을 시작함,N,,,,8차(2025-11),,,
개략,OUTL,Outline,槪略. 내용을 대강 추려 줄임 또는 그런 것,N,,,,8차(2025-11),,,
개발,DVLP,Development,"開發. 새로운 물건을 만들거나 새로운 생각을 내어놓음. 소프트웨어 공학에서는 요구분석, 설계, 코딩, 통합, 시험, 설치와 소프트웨어 제품의 인수를 지원하기 위한 소프트웨어 생명주기 프로세스를 말함",N,,,,6차(2023-11),,,
개발비,DVLCO,Development Cost,"開發費. 새 기술의 도입, 경영 조직의 개선, 시장의 개척 따위를 위하여 지출하는 돈",Y,비용,,,7차(2024-11),,,
개발자,DVLPR,Developer,"開發者. 새로운 물건을 만들거나 새로운 생각을 내놓는 사람. 소프트웨어 공학에서는 소프트웨어 생명주기 동안 개발 활동(요구 분석, 설계, 시험에서 인수까지)을 수행하는 개인 또는 조직",N,,,,6차(2023-11),,,
개방,OPN,Open,開放. 문이나 어떠한 공간 따위를 열어 자유롭게 드나들고 이용하게 함,N,,,,6차(2023-11),,,
개별,INDIV,Individual,個別. 여럿 중에서 하나씩 따로 나뉘어 있는 상태,N,,,,2차(2020-12),,,
개봉,OPEN,Open,開封. 봉하여 두었던 것을 떼거나 엶,N,,,,7차(2024-11),,,
개선,IMPV,Improvement,"改善. 잘못된 것이나 부족한 것, 나쁜 것 따위를 고쳐 더 좋게 만듦",N,,,,6차(2023-11),,,
개설,ESTBL,Establishment,開設. 설비나 제도 따위를 새로 마련하고 그에 관한 일을 시작함,N,,,,1차(2020-08),,,
개시,STRT,Start,開始. 행동이나 일 따위를 시작함 ,N,,,,1차(2020-08),,,
개업,OPBIZ,Opening of Business,開業. 영업을 처음 시작함,N,,,,1차(2020-08),,,
개요,OTLN,Outline,槪要. 간결하게 추려낸 주요 내용,Y,내용,,,6차(2023-11),,,
개월수,MCNT,Month Count,個月數. 개월의 수효,Y,수,,,6차(2023-11),,,
개인,INDV,Individuals,"個人. 국가나 사회, 단체 등을 구성하는 낱낱의 사람",N,,,,6차(2023-11),,,
개인식별,PRIDTF,Personal Identification,"個人識別. 성명을 알 수 없는 사람이나 시체의 신원을 지문, 혈액형, 발자국, 글씨 따위를 조사하여 알아내는 일",N,,,,5차(2022-07),,,
개인정보,PRVC,Privacy,"個人情報. 살아 있는 개인에 관한 정보로서 성명, 주민등록번호 및 영상 등을 통하여 개인을 알아볼 수 있는 정보(해당 정보만으로는 특정 개인을 알아볼 수 없더라도 다른 정보와 쉽게 결합하여 알아볼 수 있는 것을 포함한다)",N,,,,1차(2020-08),,,
개점,OPSTR,Open Store,"開店. 새로 가게를 내어 처음으로 영업을 시작하거나, 가게 문을 열고 하루의 영업을 시작함",N,,,,6차(2023-11),변경,공통표준단어 설명,유관 단어와의 통일성 및 적합성을 고려하여 설명 수정
개정,RVSN,Revision,改正. 주로 문서의 내용 따위를 고쳐 바르게 함,N,,,,1차(2020-08),,,
개찰,BDOPN,Bid Opening,開札. 입찰한 결과를 견주어 조사함,N,,,,6차(2023-11),,,
개체,INDVD,Individual,個體. 전체나 집단에 상대하여 하나하나의 낱개를 이르는 말,N,,,,8차(2025-11),,,
개최,HDMT,Hold A Meeting,開催. 모임이나 회의 등을 주최하여 엶,N,,,,3차(2021-10),,,
개통,OPNG,Opening,"開通. 길, 다리, 철로, 전화, 전신 따위를 완성하거나 이어 통하게 함",N,,,,5차(2022-07),,,
개편,RGNZ,Reorganization,改編. 조직 따위를 고쳐 편성함,N,,,,8차(2025-11),,,
객관식,MLCH,Multiple Choice,客觀式. ‘선택형’을 일상적으로 이르는 말,N,,,,7차(2024-11),,,
객석,ADTRM,Auditorium,客席. 극장 따위에서 손님이 앉는 자리,N,,,,7차(2024-11),,,
객실,GSRM,Guest Room,客室. 손님을 거처하게 하거나 접대할 수 있도록 정해 놓은 방,N,,,,6차(2023-11),,,
객체,OBJT,Object,客體. 의사나 행위가 미치는 대상 또는 모두 포함한 개념,N,,,,6차(2023-11),,,
갱신,UPDT,Update,更新. 이미 있던 것을 고쳐 새롭게 함,N,,업데이트,,1차(2020-08),,,
거래,DLNG,Dealings,去來. 주고 받음 또는 사고 팖,N,,,,1차(2020-08),,,
거래자,DLR,Dealer,去來者. 물건을 사고 팔거나 돈을 주고받는 사람,N,,,,6차(2023-11),,,
거래처,CNPT,Counterparty,去來處. 돈이나 물건 따위를 계속 거래하는 곳,N,,,,2차(2020-12),,,
거리,DSTNC,Distance,距離.  두 개의 물건이나 장소 따위가 공간적으로 떨어진 길이,Y,수,,,7차(2024-11),,,
거부,RJT,Rejection,拒否. 요구나 제의 따위를 받아들이지 않고 물리침,N,,,,8차(2025-11),,,
거소,PLCRS,Place Of Residence,居所. 살고 있는 곳,N,,,,8차(2025-11),,,
거절,RFSL,Refusal,"拒絕. 상대편의 요구, 제안, 선물, 부탁 따위를 받아들이지 않고 물리침",N,,,,6차(2023-11),,,
거주,HAB,Habitation,居住. 일정한 곳에 머물러 삶 또는 그런 집,N,,주거,,6차(2023-11),,,
거주자,RSDNT,Resident,居住者. 일정한 곳에 거주하는 사람,N,,,,8차(2025-11),,,
거주지,RSDC,Residence,居住地. 현재 거주하고 있는 장소,N,,,,6차(2023-11),,,
거치,DFMT,Deferment,"据置. 그대로 둠 또는 공채(公債), 사채(社債) 따위의 상환 또는 지급을 일정 기간 하지 않는 일",N,,,,6차(2023-11),,,
거치연수,DFYRS,Deferment Years,"据置年數. 공채(公債), 사채(社債) 따위의 상환 또는 지급을 일정 기간 하지 않는 해의 수",Y,수,,,6차(2023-11),,,
건강,HLTH,Health,健康. 정신적으로나 육체적으로 아무 탈이 없고 튼튼함 또는 그런 상태,N,,,,6차(2023-11),,,
